<?xml version="1.0" encoding="UTF-8"?>
<!--
  Begin Copyright

  Licensed Materials - Property of IBM

  Virtual Member Manager

  (C) Copyright IBM Corp. 2005 All Rights Reserved.

  US Government Users Restricted Rights - Use, duplication or
  disclosure restricted by GSA ADP Schedule Contract with IBM Corp.

  %Z% %W% %I% %E% %U%

  End Copyright
-->

<wimprop:repositoryProperty repositoryName="wimDB" xmlns:wimprop="http://www.ibm.com/websphere/wim/wimprop" xmlns:xsi="http://www.w3.org/2001/XMLSchema-instance" xsi:schemaLocation="http://www.ibm.com/websphere/wim/wimprop wimdbproperty.xsd ">

  <wimprop:property wimPropertyName="mail" dataType="String" valueLength="256" multiValued="false">
    <wimprop:applicableEntityName>
      <wimprop:entityName>Person</wimprop:entityName>
      <wimprop:entityName>PersonAccount</wimprop:entityName>
    </wimprop:applicableEntityName>
  </wimprop:property>
   
  <wimprop:property wimPropertyName="l" dataType="String" valueLength="256" caseExactMatch="false">
    <wimprop:applicableEntityName>
      <wimprop:entityName>Person</wimprop:entityName>
      <wimprop:entityName>PersonAccount</wimprop:entityName>
      <wimprop:entityName>OrgContainer</wimprop:entityName>
    </wimprop:applicableEntityName>
  </wimprop:property>
        
  <wimprop:property wimPropertyName="st" dataType="String" valueLength="256" caseExactMatch="false">
    <wimprop:applicableEntityName>
      <wimprop:entityName>Person</wimprop:entityName>
      <wimprop:entityName>PersonAccount</wimprop:entityName>
      <wimprop:entityName>OrgContainer</wimprop:entityName>
    </wimprop:applicableEntityName>
  </wimprop:property>
        
  <wimprop:property wimPropertyName="c" dataType="String" valueLength="256" caseExactMatch="false">
    <wimprop:applicableEntityName>
      <wimprop:entityName>Person</wimprop:entityName>
      <wimprop:entityName>PersonAccount</wimprop:entityName>
    </wimprop:applicableEntityName>
  </wimprop:property>

  <wimprop:property wimPropertyName="dc" dataType="String" valueLength="128" multiValued="false" caseExactMatch="false">
    <wimprop:applicableEntityName>
      <wimprop:entityName>OrgContainer</wimprop:entityName>
    </wimprop:applicableEntityName>
  </wimprop:property>

  <wimprop:property wimPropertyName="certificate" dataType="ByteArray" multiValued="false">
    <wimprop:applicableEntityName>
      <wimprop:entityName>PersonAccount</wimprop:entityName>
    </wimprop:applicableEntityName>
    </wimprop:property>

  <wimprop:property wimPropertyName="title" dataType="String" valueLength="128">
    <wimprop:applicableEntityName>
      <wimprop:entityName>Person</wimprop:entityName>
      <wimprop:entityName>PersonAccount</wimprop:entityName>
    </wimprop:applicableEntityName>
  </wimprop:property>

  <wimprop:compositeProperty wimPropertyName="homeAddress" dataType="Object">
    <wimprop:applicableEntityName>
      <wimprop:entityName>Person</wimprop:entityName>
      <wimprop:entityName>PersonAccount</wimprop:entityName>
    </wimprop:applicableEntityName>
    <wimprop:componentProperty wimPropertyName="nickName" dataType="String" multiValued="false" valueLength="128" requiredInComposite="true" keyInComposite="true"/>
    <wimprop:componentProperty wimPropertyName="street" dataType="String" valueLength="128" requiredInComposite="true"/>
    <wimprop:componentProperty wimPropertyName="city" dataType="String" multiValued="false" valueLength="128" requiredInComposite="true"/>
    <wimprop:componentProperty wimPropertyName="stateOrProvinceName" dataType="String" multiValued="false" valueLength="128"/>
    <wimprop:componentProperty wimPropertyName="postalCode" dataType="String" multiValued="false" valueLength="40"/>
    <wimprop:componentProperty wimPropertyName="countryName" dataType="String" multiValued="false" valueLength="128" requiredInComposite="true"/>
  </wimprop:compositeProperty>
 

  <wimprop:compositeProperty wimPropertyName="businessAddress" dataType="Object">
    <wimprop:applicableEntityName>
      <wimprop:entityName>Person</wimprop:entityName>
      <wimprop:entityName>PersonAccount</wimprop:entityName>
      <wimprop:entityName>OrgContainer</wimprop:entityName>
    </wimprop:applicableEntityName>
    <wimprop:componentProperty wimPropertyName="nickName" dataType="String" multiValued="false" valueLength="128" requiredInComposite="true" keyInComposite="true"/>
    <wimprop:componentProperty wimPropertyName="street" dataType="String" valueLength="128" requiredInComposite="true"/>
    <wimprop:componentProperty wimPropertyName="city" dataType="String" multiValued="false" valueLength="128" requiredInComposite="true"/>
    <wimprop:componentProperty wimPropertyName="stateOrProvinceName" dataType="String" multiValued="false" valueLength="128"/>
    <wimprop:componentProperty wimPropertyName="postalCode" dataType="String" multiValued="false" valueLength="40"/>
    <wimprop:componentProperty wimPropertyName="countryName" dataType="String" multiValued="false" valueLength="128" requiredInComposite="true"/>
  </wimprop:compositeProperty>
 
-->
</wimprop:repositoryProperty>
